Symbol,Name,Last Sale,Net Change,% Change,Market Cap,Country,IPO Year,Volume,Sector,Industry
WKC,World Kinect Corporation Common Stock,$22.40 ,-0.06,-0.27%,1348521104,United States,,137315,Energy,Oil Refining/Marketing
WTI,W&T Offshore Inc. Common Stock,$3.19 ,-0.12,-3.63%,467571676,United States,2005,1153968,Energy,Oil & Gas Production
WTTR,Select Water Solutions Inc. Class A common stock,$7.36 ,-0.185,-2.45%,883615041,United States,2017,156457,Energy,Oilfield Services/Equipment
WWD,Woodward Inc. Common Stock,$133.24 ,0.625,0.47%,7998370981,United States,,83025,Energy,Industrial Machinery/Components
XOM,Exxon Mobil Corporation Common Stock,$102.89 ,-0.33,-0.32%,4.07745E+11,United States,,7810614,Energy,Integrated oil Companies
XPRO,Expro Group Holdings N.V. Common Stock,$15.54 ,-0.38,-2.39%,1719843315,United States,2013,244331,Energy,Oilfield Services/Equipment
YPF,YPF Sociedad Anonima Common Stock,$16.78 ,0.005,0.03%,6596952990,Argentina,1993,630835,Energy,Integrated oil Companies